<!DOCTYPE aspectwerkz PUBLIC "-//AspectWerkz//DTD//EN" "http://aspectwerkz.codehaus.org/dtd/aspectwerkz.dtd">
<aspectwerkz>
    <system id="awbench">
        <aspect class="awbench.extension.spring.MethodExecutionBeforeAdvice">
            <advice name="before" type="before" bind-to="execution(* awbench.method.Execution.before(..))"/>
        </aspect>
        <aspect class="awbench.extension.spring.MethodExecutionBeforeAdviceSJP">
            <advice name="before" type="before" bind-to="execution(* awbench.method.Execution.beforeSJP(..))"/>
        </aspect>
        <aspect class="awbench.extension.spring.MethodExecutionBeforeAdviceJP">
            <advice name="before" type="before" bind-to="execution(* awbench.method.Execution.beforeJP(..))"/>
        </aspect>
        <aspect class="awbench.extension.spring.MethodExecutionBeforeWithPrimitiveArgsAdvice">
            <advice name="before" type="before" bind-to="execution(* awbench.method.Execution.beforeWithPrimitiveArgs(..))"/>
        </aspect>
        <aspect class="awbench.extension.spring.MethodExecutionAfterAdvice">
            <advice name="afterReturning" type="after returning" bind-to="execution(* awbench.method.Execution.*After(..))"/>
        </aspect>
        <aspect class="awbench.extension.spring.MethodExecutionAfterReturningAdvice">
            <advice name="afterReturning" type="after returning(java.lang.String)" bind-to="execution(* awbench.method.Execution.afterReturningString())"/>
        </aspect>
<!--        <aspect class="awbench.extension.spring.MethodExecutionAfterThrowingAdvice">-->
<!--            <advice name="afterThrowing" type="after throwing(java.lang.RuntimeException)" bind-to="execution(* awbench.method.Execution.afterThrowingRTE())"/>-->
<!--        </aspect>-->
        <aspect name="around1" class="awbench.extension.spring.MethodExecutionGetTargetAndArgsAroundAdvice">
            <advice name="invoke" type="around" bind-to="execution(* awbench.method.Execution.aroundStackedWithArgAndTarget(..))"/>
        </aspect>
        <aspect name="around2" class="awbench.extension.spring.MethodExecutionGetTargetAndArgsAroundAdvice">
            <advice name="invoke" type="around" bind-to="execution(* awbench.method.Execution.aroundStackedWithArgAndTarget(..))"/>
        </aspect>
        <aspect class="awbench.extension.spring.MethodExecutionAroundAdvice">
            <advice name="invoke" type="around" bind-to="execution(* awbench.method.Execution.around_())"/>
        </aspect>
        <aspect class="awbench.extension.spring.MethodExecutionAroundAdviceSJP">
            <advice name="invoke" type="around" bind-to="execution(* awbench.method.Execution.aroundSJP())"/>
        </aspect>
        <aspect class="awbench.extension.spring.MethodExecutionAroundAdviceJP">
            <advice name="invoke" type="around" bind-to="execution(* awbench.method.Execution.aroundJP())"/>
        </aspect>
    </system>
</aspectwerkz>
