<!DOCTYPE aspectwerkz PUBLIC
    "-//AspectWerkz//DTD//EN"
    "http://aspectwerkz.codehaus.org/dtd/aspectwerkz.dtd">
<aspectwerkz>
    <system id="samples">
        <package name="examples">
            <aspect class="caching.Fibonacci$FibonacciCacheAspect" deployment-model="perInstance"/>
            <aspect class="caching.CachingAspect" deployment-model="perInstance" >
                <param name="timeout" value="10"/>
            </aspect>

            <aspect class="introduction.IntroductionAspect" deployment-model="perClass"/>
            <aspect class="cflow.CFlowAspect"/>
            <aspect class="exception.ExceptionHandlingAspect"/>
            <aspect class="logging.ArgAspect"/>
            <aspect class="logging.PreparePointcuts"/>

            <aspect class="annotation.Target$AnnotationMatchAspect"/>

            <!--            <aspect class="logging.XmlDefLoggingAspect">-->
            <!--                <pointcut name="methodsToLog" expression="execution(* examples.logging.Target.toLog*(..))"/>-->
            <!--                <advice name="logMethod" type="around" bind-to="methodsToLog"/>-->
            <!--                <advice name="logBefore" type="before" bind-to="methodsToLog"/>-->
            <!--            </aspect>-->
        </package>
    </system>
</aspectwerkz>
