<!DOCTYPE aspectwerkz PUBLIC
    "-//AspectWerkz//DTD//EN"
    "http://aspectwerkz.codehaus.org/dtd/aspectwerkz.dtd">
<aspectwerkz>
    <system id="samples">
        <prepare package="examples.logging."/>
        <package name="examples">
            <aspect class="caching.Fibonacci$FibonacciCacheAspect" deployment-model="perInstance"/>
            <aspect class="caching.CachingAspect">
                <param name="timeout" value="10"/>
            </aspect>
            <aspect class="logging.LoggingAspect">
                <advice bind-to="execution(* examples.logging.Target.to*(..))" type="before" name="logEntry"/>
                <advice bind-to="execution(* examples.logging.Target.to*(..))" type="after" name="logExit"/>
            </aspect>
            <aspect class="logging.LoggingAspect"/>
            <aspect class="introduction.IntroductionAspect" deployment-model="perClass"/>
            <aspect class="cflow.CFlowAspect"/>
            <aspect class="exception.ExceptionHandlingAspect"/>
        </package>
    </system>
</aspectwerkz>
